{"project_id":"pems:project:f16c91ec0a6e67eb2e1d","records":[{"data":{"head_commit":"0c62cbcfbfef7eac03213f23b0fdc311d7e3afa4","name":"main","repository":"loteque/gdscript-voxel-engine"},"id":"pems:branch:f3c00d62e3780ff354c3","kind":"branch","lifecycle":"current","provenance":{"untyped":["pems:source_observation:8b224fe848a009ff335f","pems:source_observation:8c186a6ca2398e0cfe5e"]}},{"data":{"active_role_id":"pems:role:c1e3846587fc0b8b52a8","ended_at":null,"project_id":"pems:project:f16c91ec0a6e67eb2e1d","started_at":"2026-08-09T00:00:00Z","summary":"Designed the transition from a single field/mesh into deterministic Vector3i-addressed generation chunks, persisted assets/manifests, and runtime streaming, establishing the offline/runtime split later implemented.","title":"Chunking System Design"},"id":"pems:chat:1e4114ca315d0f97fb70","kind":"chat","lifecycle":"current","provenance":{"untyped":["pems:source_observation:8c186a6ca2398e0cfe5e"]}},{"data":{"active_role_id":"pems:role:ffb6785e32828e995410","ended_at":null,"project_id":"pems:project:f16c91ec0a6e67eb2e1d","started_at":"2026-08-10T00:00:00Z","summary":"Focused on field freshness, authoritative indexing, bulk density installation, consumer correctness, documentation conventions, and avoiding unnecessary wrappers or broad refactors.","title":"API Review and Refinement"},"id":"pems:chat:36e377bd8232f9b8c667","kind":"chat","lifecycle":"current","provenance":{"untyped":["pems:source_observation:8c186a6ca2398e0cfe5e"]}},{"data":{"active_role_id":"pems:role:4df1b01142c12f7385d4","ended_at":null,"project_id":"pems:project:f16c91ec0a6e67eb2e1d","started_at":"2026-08-10T00:00:00Z","summary":"Added and iterated touch controls so browser/mobile demos can be navigated and validated, converging on one shared MobileTouchControls implementation.","title":"Add a player control UI for touch on mobile"},"id":"pems:chat:38a205145fd68f21834f","kind":"chat","lifecycle":"current","provenance":{"untyped":["pems:source_observation:8c186a6ca2398e0cfe5e"]}},{"data":{"active_role_id":"pems:role:e04b5725a60125439893","ended_at":null,"project_id":"pems:project:f16c91ec0a6e67eb2e1d","started_at":"2026-08-07T00:00:00Z","summary":"Designed and implemented SurfaceNetsMesher consuming PointFieldResource, repaired checks and integration issues, and reviewed the implemented feature scope.","title":"Surface Net Mesher Design"},"id":"pems:chat:6accb3987c9c19f32b66","kind":"chat","lifecycle":"current","provenance":{"untyped":["pems:source_observation:8c186a6ca2398e0cfe5e"]}},{"data":{"active_role_id":"pems:role:2e9bf5d04d73a8b9768d","ended_at":null,"project_id":"pems:project:f16c91ec0a6e67eb2e1d","started_at":"2026-08-07T00:00:00Z","summary":"Debugged workflow/export failures and helped establish immutable release demos plus a mutable Integration Preview with manifest/selector injection.","title":"Workflows"},"id":"pems:chat:761756ff442a837a208c","kind":"chat","lifecycle":"current","provenance":{"untyped":["pems:source_observation:8c186a6ca2398e0cfe5e"]}},{"data":{"active_role_id":"pems:role:b9d98818da2e4eebaed4","ended_at":null,"project_id":"pems:project:f16c91ec0a6e67eb2e1d","started_at":"2026-08-13T00:00:00Z","summary":"Created the project handoff and stewarded its engineering-memory migration through the frozen PEMS/COVE v1 sequence. Phases 1 through 7 are accepted complete and the verified Phase 8 cutover makes docs/project-chat-handoff.cove.json canonical, with docs/project-chat-handoff.json as its deterministic compatibility derivative. Phase 8 technical cutover and final Steward governance closeout are complete. Complete-source repository-write safety remains mandatory for append-only and history-sensitive artifacts.","title":"Project Engineering Steward / Handoff Memory"},"id":"pems:chat:7da38ee068988502fe3b","kind":"chat","lifecycle":"current","provenance":{"untyped":["pems:source_observation:15b32d4adb9bcfa4fc94","pems:source_observation:8c186a6ca2398e0cfe5e","pems:source_observation:be6819991bf46e7cc226"]}},{"data":{"active_role_id":"pems:role:c6d61494a1de5f99542a","ended_at":null,"project_id":"pems:project:f16c91ec0a6e67eb2e1d","started_at":"2026-08-04T00:00:00Z","summary":"Built the original point-field tooling and produced the first detailed split between PointFieldResource and PointFieldVisualizer, seeding the later architecture.","title":"Voxel Terrain Generator GDScript"},"id":"pems:chat:81f40007c5eca4f5d20b","kind":"chat","lifecycle":"current","provenance":{"untyped":["pems:source_observation:8c186a6ca2398e0cfe5e"]}},{"data":{"active_role_id":"pems:role:eabd3dd9a3d136791fb5","ended_at":null,"project_id":"pems:project:f16c91ec0a6e67eb2e1d","started_at":"2026-08-07T00:00:00Z","summary":"Iterated the project splash toward a simpler title-centered design and integrated SVG source plus PNG runtime artwork.","title":"New splash screen design"},"id":"pems:chat:b43f0bbd4bae1bb82951","kind":"chat","lifecycle":"current","provenance":{"untyped":["pems:source_observation:8c186a6ca2398e0cfe5e"]}},{"data":{"active_role_id":"pems:role:4cce46045ae0ca437ebc","ended_at":null,"project_id":"pems:project:f16c91ec0a6e67eb2e1d","started_at":"2026-08-10T00:00:00Z","summary":"Reviewed demos, added streaming validation to the web deployment path, fixed missing demo data, switched validation to noise-generated terrain, and prepared integration after architecture/tests/browser QA were satisfactory.","title":"API Assessment Review"},"id":"pems:chat:c360598f62de744048ff","kind":"chat","lifecycle":"current","provenance":{"untyped":["pems:source_observation:8c186a6ca2398e0cfe5e"]}},{"data":{"active_role_id":"pems:role:d68bfd23c188c4931ddf","ended_at":null,"project_id":"pems:project:f16c91ec0a6e67eb2e1d","started_at":"2026-08-06T00:00:00Z","summary":"Primary architecture-governance thread. Historically reviewed prior work as an engineering mentor, assessed engineering behavior, established ADR/roadmap recording, and reviewed planning proposals. It now continues under the Project Architecture and Governance Mentor role for evidence-driven architectural mentorship and project governance while preserving the historical role record and terminology.","title":"Procedural Terrain Architecture"},"id":"pems:chat:c55923a23d38b4ef7955","kind":"chat","lifecycle":"current","provenance":{"untyped":["pems:source_observation:8c186a6ca2398e0cfe5e","pems:source_observation:8c7b03e7eb17cc709223"]}},{"data":{"active_role_id":"pems:role:0898592ff67eca51a52e","ended_at":null,"project_id":"pems:project:f16c91ec0a6e67eb2e1d","started_at":"2026-08-10T00:00:00Z","summary":"Explained Dual Contouring from scalar-field sign changes through Hermite samples, gradients, tangent-plane constraints, QEF minimization, topology generation, and chunk-boundary concerns in the context of the existing architecture.","title":"Dual Contouring Explanation"},"id":"pems:chat:c65bac90aac998cbab0a","kind":"chat","lifecycle":"current","provenance":{"untyped":["pems:source_observation:8c186a6ca2398e0cfe5e"]}},{"data":{"active_role_id":"pems:role:8708e69194340285b35a","ended_at":null,"project_id":"pems:project:f16c91ec0a6e67eb2e1d","started_at":"2026-08-10T00:00:00Z","summary":"Tracked the completed foundational generation and first runtime streaming architecture, especially chunk residency PR #43 and its validation/demo requirements, and confirmed CI/publication state when requested.","title":"Godot Voxel Terrain Progress"},"id":"pems:chat:c8c0ed81ab57c89504d9","kind":"chat","lifecycle":"current","provenance":{"untyped":["pems:source_observation:8c186a6ca2398e0cfe5e"]}},{"data":{"active_role_id":"pems:role:85218199af8f7090e8ab","ended_at":null,"project_id":"pems:project:f16c91ec0a6e67eb2e1d","started_at":"2026-08-06T00:00:00Z","summary":"Helped connect the project to GitHub, draft repository descriptions, discuss connector access, and establish the repository as the shared implementation surface.","title":"Connecting GitHub to Project"},"id":"pems:chat:d18e189534f528af6b0d","kind":"chat","lifecycle":"current","provenance":{"untyped":["pems:source_observation:8c186a6ca2398e0cfe5e"]}},{"data":{"active_role_id":"pems:role:084d0317520c98afb688","ended_at":null,"project_id":"pems:project:f16c91ec0a6e67eb2e1d","started_at":"2026-08-10T00:00:00Z","summary":"Extended ChunkStreamer from individual load/unload operations into deterministic target-relative residency. Incomplete validation coverage and web exposure were corrected, reinforcing the project's feature-completion standard.","title":"Chunk Residency Implementation"},"id":"pems:chat:d6e9b35856b8eeb09a12","kind":"chat","lifecycle":"current","provenance":{"untyped":["pems:source_observation:8c186a6ca2398e0cfe5e"]}},{"data":{"active_role_id":"pems:role:c1e3846587fc0b8b52a8","blocker_ids":[],"chat_id":"pems:chat:1e4114ca315d0f97fb70","current_focus":"Designed the transition from a single field/mesh into deterministic Vector3i-addressed generation chunks, persisted assets/manifests, and runtime streaming, establishing the offline/runtime split later implemented.","high_value_record_ids":["pems:chat:1e4114ca315d0f97fb70","pems:decision:44e002aa25bee2d2d4e6","pems:decision:620591211ebd9577effc","pems:decision:98bd2b333893e80c7643","pems:decision:f6b3586c994756e317f3","pems:role:c1e3846587fc0b8b52a8"],"pending_owner_decision_ids":[]},"id":"pems:continuation:1e4114ca315d0f97fb70","kind":"continuation","lifecycle":"current","provenance":{"untyped":["pems:source_observation:8c186a6ca2398e0cfe5e"]}},{"data":{"active_role_id":"pems:role:ffb6785e32828e995410","blocker_ids":[],"chat_id":"pems:chat:36e377bd8232f9b8c667","current_focus":"Focused on field freshness, authoritative indexing, bulk density installation, consumer correctness, documentation conventions, and avoiding unnecessary wrappers or broad refactors.","high_value_record_ids":["pems:chat:36e377bd8232f9b8c667","pems:decision:259c40a69e7affd060ca","pems:decision:6d8b1f711dde51b2c333","pems:decision:791428866ec88a185625","pems:decision:cbc0de6479c9b702f6c8","p